{
  "$schema": "../schemas/theme.schema.json",
  "name": "Eagle Midnight",
  "author": "RemoteDeck",
  "base": "dark",
  "backdrop": "mica",
  "colors": {
    "background": "#050D1AEB",
    "surface": "#0A1830EB",
    "surfaceAlt": "#10264A",
    "foreground": "#EAF1FF",
    "mutedForeground": "#7F93B5",
    "accent": "#1E88FF",
    "accentForeground": "#FFFFFF",
    "border": "#17305A",
    "success": "#3DDC97",
    "warning": "#FFD166",
    "danger": "#FF5C7A",
    "broadcast": "#FF9F43"
  },
  "terminal": {
    "background": "#040B16",
    "foreground": "#EAF1FF",
    "cursor": "#4DA3FF",
    "selection": "#12356B",
    "ansi": [
      "#0A1830",
      "#FF5C7A",
      "#3DDC97",
      "#FFD166",
      "#1E88FF",
      "#B07CFF",
      "#27C6F5",
      "#DCE7FA",
      "#3A5078",
      "#FF8199",
      "#69F0B4",
      "#FFE08A",
      "#5AA9FF",
      "#C9A3FF",
      "#6EDCFF",
      "#FFFFFF"
    ]
  },
  "shape": {
    "cornerRadius": 10,
    "borderWidth": 1,
    "density": "comfortable"
  },
  "font": {
    "ui": "Segoe UI Variable",
    "mono": "Cascadia Code",
    "size": 13
  }
}
